{
  "schema": "stealth.session.evidence.v1",
  "session_id": "ses_authorization_demo_001",
  "directory": "C:\\demo\\stealth-project",
  "task": {
    "title": "Update a README sentence",
    "prompt": "Update the requested README sentence and show the resulting diff."
  },
  "agent": {
    "id": "build",
    "runtime": "Stealth"
  },
  "scope": {
    "permission": [
      {
        "permission": "bash",
        "pattern": "git diff -- README.md",
        "action": "allow"
      }
    ]
  },
  "authorization": {
    "delegation_ref": null,
    "delegator": null,
    "agent_operator": "build",
    "target": "C:\\demo\\stealth-project",
    "allowed_actions": [
      {
        "permission": "bash",
        "pattern": "git diff -- README.md",
        "action": "allow"
      }
    ],
    "authorization_valid_from": null,
    "authorization_expiry": null,
    "authorization_checked_at": 1781000003000,
    "authorization_state_hash": "aaaaaaaaaaaaaaaaaaaaaaaaaaaaaaaaaaaaaaaaaaaaaaaaaaaaaaaaaaaaaaaa",
    "authorized_at_execution": null
  },
  "execution": [
    {
      "call_id": "call_demo_001",
      "tool": "bash",
      "action_performed": "git diff -- README.md",
      "target": "C:\\demo\\stealth-project",
      "execution_timestamp": 1781000001000,
      "completed_timestamp": 1781000002000,
      "status": "completed",
      "scope_match": null
    }
  ],
  "commands": [
    {
      "command": "git diff -- README.md",
      "exit_code": 0
    }
  ],
  "changes": {
    "files_changed": [
      "README.md"
    ],
    "diff_sha256": "bbbbbbbbbbbbbbbbbbbbbbbbbbbbbbbbbbbbbbbbbbbbbbbbbbbbbbbbbbbbbbbb"
  },
  "metadata": {
    "message_count": 2,
    "diff_count": 1,
    "generated_by": "stealth.handoff.evidence.builder.v1"
  }
}
